start	end	text
1996681	2000343	Per noi, tanto che gli avevo già dichiarati, è chiaro?
2001639	2009421	E lì scoprirete che il C++, come tutti i guanti, ha un albero delle eccezioni.
2010942	2020325	Ci sono delle classi, classi, exception, che gestiscono situazioni specifiche.
2020365	2021465	Quello è l'approfondimento.
2024266	2027787	Studiare quell'albero significa questo conto avere di strumenti pronti
2029136	2036302	che il CPU mette a disposizione per gestire delle situazioni specifiche, tipo per esempio una catalogazione di spazi in memoria.
2038124	2040626	Non la gestisco, lancio l'accezione.
2041426	2041967	Come?
2042027	2042908	Con quale codice?
2043008	2044229	Con quella che ti dà il CPU.
2045350	2049253	Ma questo, come un trasatore, cioè questo è l'approfondimento.
2050294	2052896	Come anche tutti gli uggagli, no?
2052936	2057459	L'accezione di appronte che gestiscono le situazioni specifiche.
2059384	2071806	tipo hai superato i limiti della base vector non puoi inserire più niente eccezione quando andrete a guardare, no?
2072946	2085069	la STL quando andate a vedere, cercate le eccezioni che è bravo, è bravo, è bravo adesso cominci a collegare le due
2087722	2094512	Tutte quelle parole che avete incrociato, adesso avete l'astrumento per poter fare il meglio e conderele.
2094952	2097676	E dire, mo capisco che cazzo volevano dire quelle cose.
2099339	2100721	Questo è il lavoro che vogliamo fare.
2104785	2123360	perché gli ho dato un compito, gli ho detto guardate le figure io gli ho fatto una richiesta se avete fatto quel lavoro sapete di cosa sto parlando, se non l'avete fatto siete nella merda non lo capirete mai, non lo capirete sempre
2125459	2131280	Perché l'obiettivo è chiaro, ve la do da studiare, ci saranno delle cose che non capirete.
2131640	2134261	Se non mi dite non ho capito questo, non l'avete letto.
2135981	2137001	No, non l'avete letto.
2139462	2143263	E se tu mi dici che l'hai letto, mi sta prendendo per il culo e mi gira in coglione.
2145143	2147283	Perché non puoi leggere una cosa che non capisci.
2147323	2148324	Che cazzo leggi a fare?
2148344	2149584	Non sta capisci il Cristo.
2152762	2155404	Allora mi prendi per il culo e poi diventi una bestia, no?
2155744	2162350	Ma l'anno scorso hai detto sì, ma io leggo queste cose, poi le dico template, non capisco un cazzo, te lo ricordi?
2163210	2169875	L'anno scorso abbiamo parlato del template appunto perché ho fatto questo intervento e faccio sì, ci hai dato la libreria da legge, ma poi mi trovo template, non so che cazzo vuol dire.
2171817	2172237	Certo.
2172878	2178342	Il discorso è, l'ho letto, io l'ho capito, sono andato in crisi, ok, e la prossima lezione?
2180891	2183294	però ti devi schiantare, ti devi fare male.
2184094	2188959	E' inutile che te lo spiego in sequenza, è chiaro che se io te lo spiego in sequenza tutto funziona.
2205035	2206996	Quindi, cosa vi chiedo di fare?
2207296	2215538	Ok, il modo che tornerà eccezionale, avete due modi da chistire, da esplorare.
2215698	2226862	Uno è il corso delle fasi dell'interfaccia, che è lo che si deve rendere appunto per la domanda di fare.
2227042	2233604	Volevo dire che c'è questa introduzione al mondo delle eccezioni.
2234423	2263673	avrei potuto ripetare questo mondo con un quarto d'ora e sarebbe stato sufficiente dire che tra il catch e il throw ad esempio il pilota mi avrebbe risposto ad esempio il pilota vi avrei chiesto qualcosa di sim da quello l'avreste fatto ma avreste ripetito il caso ma poi ho voluto dedicare un po' di tempo per fare questo riflettere
2265644	2281758	e dirgli c'è un mondo che lo volete esplorare bene altrimenti state tranquilli volete restare nel mondo della programmazione, chi crocerà di questo problema?
2281778	2288524	C'è un'altra cosa che vi ho detto, come poi l'abbiamo fatto adesso in tre anni tu stai registrando?
2289385	2290706	BIP BIP BIP BIP
